{
  "late": false,
  "wake": {
    "score": 20,
    "points": 17,
    "reason": "ok",
    "status": "succeeded",
    "deadline": "2026-10-20T05:30:00Z",
    "occurrenceId": "a0000000-0000-4000-8000-000000000001:2026-10-20",
    "finalTargetReps": 20
  },
  "streak": {
    "best": 1,
    "current": 1,
    "pureBest": 1,
    "pureCurrent": 1,
    "lastCountedDate": "2026-10-20",
    "freezesAvailable": 0
  },
  "totals": {
    "repsToday": 20,
    "repsAllTime": 20
  },
  "verified": true,
  "sessionId": "f0000000-0000-4000-8000-000000000001",
  "avgQuality": 92,
  "repsCounted": 20,
  "progress": {
    "xp": 290,
    "level": 3,
    "levelUp": true,
    "xpGained": 40,
    "xpForNext": 237,
    "xpIntoLevel": 7,
    "newAchievements": [
      {
        "id": "first_wake",
        "xp": 50,
        "icon": "sunrise",
        "tier": 1,
        "title": "First Wake",
        "description": "Beat your first wake-up challenge."
      },
      {
        "id": "textbook",
        "xp": 200,
        "icon": "graduationcap.fill",
        "tier": 2,
        "title": "Textbook",
        "description": "Finish a session of 10+ push-ups with average form 90 or better."
      }
    ]
  },
  "newBestSet": false
}
